{
  "tender_id": "T-001",
  "title": "Construction of District Hospital Wing-B, Lucknow",
  "risk_level": "medium",
  "rule_finding_ids": ["F-1"],
  "graph_flag_ring_ids": [],
  "linked_vendors": [],
  "summary": "Contradictory eligibility clauses detected: turnover must be both >= 50 cr (CL2) and <= 10 cr (CL5). No vendor can satisfy both requirements simultaneously. No network-level flags found for this tender.",
  "decision": "review",
  "reasoning": "The Z3 solver proves that clauses CL2 and CL5 are mutually exclusive, making it impossible for any vendor to qualify. Per GFR Rule 173 (KB-001), eligibility criteria must be 'fair, reasonable and non-restrictive'. A contradictory set of criteria effectively bars all participation, which may indicate a drafting error or an intent to cancel and re-tender to a preferred party. Recommend manual review of clause origins and amendment history.",
  "citations": [
    { "ref": "KB-001", "kind": "guideline" },
    { "ref": "F-1", "kind": "finding" }
  ],
  "recommended_actions": [
    "Flag contradictory clauses CL2 and CL5 to the tender-issuing authority for clarification or corrigendum.",
    "Review amendment history to determine if the contradiction was introduced after the original publication.",
    "Check if a re-tender was issued with revised criteria favoring a specific vendor."
  ],
  "decision_source": "cache",
  "disclaimer": "Risk indicators only; not a finding of wrongdoing. Recommendation requires human review."
}

